THREAD_ID,SLACK_CHANNEL,USER,TEXT
2018-06-01 09:00:00,engineering,"@tom.dev","Initial SmartCollar design specs finalized. Moisture resistance rated for IP67."
2018-07-15 10:30:00,manufacturing,"@sarah.eng","First production run successful. All units passing 85% RH threshold test."
2019-01-10 14:20:00,support,"@mike.support","Customer satisfaction at 98% for SmartCollar. Great job team!"
2019-06-20 11:45:00,engineering,"@tom.dev","New moisture sensor calibration process implemented. Improved accuracy by 15%."
2020-02-15 09:30:00,manufacturing,"@john.qc","Quality audit complete. All batches meeting IP67 standards."
2020-08-01 13:15:00,support,"@mike.support","SmartCollar return rate holding steady at 2.1%. Industry leading!"
2021-03-10 10:00:00,engineering,"@sarah.eng","Updated moisture sensor firmware v2.0 deployed. Enhanced power efficiency."
2021-09-05 15:30:00,manufacturing,"@john.qc","Production capacity increased. Quality metrics maintained."
2022-01-20 11:20:00,support,"@mike.support","EMEA satisfaction scores highest among all regions."
2022-07-15 14:45:00,engineering,"@tom.dev","SmartCollar v2 design phase starting. Focus on battery optimization."
2023-02-01 09:15:00,manufacturing,"@sarah.eng","New supplier for moisture sensors approved. Same specs, better cost."
2023-08-10 13:40:00,support,"@mike.support","SmartCollar consistently outperforming competitors in wet weather tests."
2024-01-05 10:30:00,engineering,"@tom.dev","Starting production validation for new sensor batch."
2024-09-15 11:45:00,manufacturing,"@john.qc","New supplier's first major batch (lot 340) passes all QC tests."
2024-10-01 09:15:00,manufacturing,"@john.qc","Starting QA on SmartCollar lot 341. Initial tests look normal."
2024-10-01 14:30:00,manufacturing,"@sarah.eng","@john.qc noticed some inconsistent readings on the moisture sensors for lot 341. Running additional tests."
2024-10-02 10:45:00,manufacturing,"@john.qc","Moisture sensor calibration on lot 341 showing higher sensitivity than spec. @sarah.eng can we check the baseline?"
2024-10-02 11:30:00,manufacturing,"@sarah.eng","Confirmed issue with moisture sensitivity. Lot 341 triggering at 65% RH instead of 85% RH spec."
2024-10-03 09:00:00,support,"@mike.support","Seeing first customer reports about battery drain on new SmartCollar units. Any known issues?"
2024-10-03 10:15:00,engineering,"@tom.dev","Investigating battery drain reports. Might be related to moisture sensor cycling."
2024-10-05 14:20:00,engineering,"@sarah.eng","Root cause identified: moisture sensor triggering too frequently, causing excessive battery drain."
2024-10-06 09:30:00,manufacturing,"@john.qc","All lot 341 units affected by moisture sensor calibration issue. Estimated 2500 units shipped to EMEA."
2024-10-08 11:45:00,engineering,"@tom.dev","Developing firmware hotfix for moisture sensor threshold. Should reduce battery drain."
2024-10-15 16:00:00,support,"@mike.support","Multiple returns from EMEA region, all citing battery life issues. Most from lot 341."
2024-11-01 10:30:00,engineering,"@tom.dev","Firmware hotfix ready for deployment. Increases moisture threshold to 85% RH."
2024-11-05 15:45:00,support,"@mike.support","Firmware update helping some cases, but seeing physical damage from moisture in returns."
2024-11-10 09:20:00,manufacturing,"@sarah.eng","Analysis shows lot 341 moisture sensor issue is hardware-related. Can't fully fix with firmware."
2024-12-01 14:15:00,support,"@mike.support","Return rate for lot 341 now at 35%. Mostly from high-humidity regions in EMEA."
2024-12-15 10:30:00,manufacturing,"@john.qc","New manufacturing process implemented for moisture sensor calibration. Future lots will meet 85% RH spec."
2024-12-20 09:15:00,engineering,"@tom.dev","Investigating alternative moisture sensor suppliers for future production."
2024-12-22 11:30:00,manufacturing,"@sarah.eng","Quality audit of remaining lot 341 stock confirms systemic calibration issue."
2024-12-23 14:45:00,support,"@mike.support","Implementing proactive replacement program for affected EMEA customers."
2024-12-24 10:00:00,engineering,"@tom.dev","New sensor validation protocol developed to prevent future calibration issues."
2024-12-26 15:30:00,manufacturing,"@john.qc","First batch with new validation protocol shows consistent 85% RH threshold."
2024-12-28 09:45:00,support,"@mike.support","Customer satisfaction improving with replacement program."
2024-12-30 11:15:00,engineering,"@sarah.eng","Long-term fix: Adding automated calibration verification to production line."
2025-01-02 10:30:00,manufacturing,"@john.qc","New automated calibration system being installed. Testing begins next week."
